{
  "contract_version": "3.0.0",
  "project_id": "pj_000000000000000000000001",
  "storyline_thesis": "先确认问题与证据，再提出有依据、可验证的行动建议。",
  "sections": [
    {
      "section_id": "sec-decision",
      "title": "形成行动判断"
    }
  ],
  "pages": [
    {
      "page_number": 1,
      "section_id": "sec-decision",
      "claim": "行动建议应回应已识别的障碍，并明确如何验证效果。",
      "supports": [
        "问题的判断需要来自实际材料，区分观察到的现象与对原因的解释。",
        "行动的选择需要说明它如何改变关键障碍，以及为何优于其他选择。",
        "效果尚未证实时，应先提出验证安排，保留成本与可行性的未知。"
      ],
      "notes": "格式示例；实际项目用自己的判断、材料定位与边界替换。"
    }
  ]
}
